{
  "$schema": "https://json-schema.org/draft/2020-12/schema",
  "$id": "https://baton.sawy3r.net/schemas/spec-v1.json",
  "title": "Baton Slice Spec",
  "description": "The machine-readable contract for one slice: the user outcome, the in/out-of-scope boundary, the needs it covers, and its acceptance criteria as EARS-notation entries with trace links. Human-authored rationale lives in the free-text 'rationale' field; runtime state lives in status.json (slice-status-v1).",
  "type": "object",
  "additionalProperties": false,
  "required": ["slice_id", "user_outcome", "covers_needs", "acceptance_criteria", "in_scope", "out_of_scope"],
  "$defs": {
    "id_token": {
      "type": "string",
      "description": "A clean identifier token. Disallows whitespace and ':' so a newline-fusion defect fails validation by construction.",
      "pattern": "^[A-Za-z0-9][A-Za-z0-9._-]*$",
      "minLength": 1
    },
    "need_id": {
      "type": "string",
      "pattern": "^N-\\d+$",
      "description": "Intake need id, e.g. N-01."
    },
    "ears_pattern": {
      "type": "string",
      "description": "EARS pattern class. 'none' (free-form, unmatched) is deliberately excluded — it is a Rule 8 violation the lint catches, never a valid authored value.",
      "enum": ["ubiquitous", "event-driven", "state-driven", "optional-feature", "unwanted-behaviour", "complex", "note"]
    },
    "effort_axis": {
      "type": "string",
      "enum": ["low", "high"]
    },
    "contract_id": {
      "type": "string",
      "pattern": "^C-[0-9]{2,}$"
    },
    "reference": {
      "oneOf": [
        {
          "type": "object",
          "additionalProperties": false,
          "required": ["kind", "contract_id"],
          "properties": {
            "kind": { "const": "contract" },
            "contract_id": { "$ref": "#/$defs/contract_id" }
          }
        },
        {
          "type": "object",
          "additionalProperties": false,
          "required": ["kind", "slice_id"],
          "properties": {
            "kind": { "const": "slice" },
            "slice_id": { "$ref": "#/$defs/id_token" }
          }
        },
        {
          "type": "object",
          "additionalProperties": false,
          "required": ["kind", "path"],
          "properties": {
            "kind": { "const": "file" },
            "path": {
              "type": "string",
              "minLength": 1,
              "description": "Workspace-root-relative slash path. The engine applies the exact lexical, normalization, and confinement rules in baton/llm-checks/README.md before reading it."
            }
          }
        }
      ]
    }
  },
  "properties": {
    "$schema": {
      "type": "string",
      "const": "https://baton.sawy3r.net/schemas/spec-v1.json"
    },
    "slice_id": { "$ref": "#/$defs/id_token" },
    "release": { "type": "string" },
    "track": { "$ref": "#/$defs/id_token" },
    "user_outcome": {
      "type": "string",
      "minLength": 1,
      "description": "One sentence: the user-facing outcome this slice delivers."
    },
    "rationale": {
      "type": "string",
      "description": "Human-authored prose explaining the slice. Optional; never machine-parsed."
    },
    "touchpoints": {
      "type": "array",
      "description": "Files/paths this slice owns. Used by track-disjointness and design-fit checks.",
      "items": { "type": "string" }
    },
    "references": {
      "type": "array",
      "description": "Typed direct normative inputs consumed by spec-ambiguity. Engines scan only this field for referenced artefacts; prose, touchpoints, and test_refs are not reference-discovery surfaces. Optional for compatibility with pre-field specs; current planners emit it even when empty.",
      "uniqueItems": true,
      "items": { "$ref": "#/$defs/reference" }
    },
    "in_scope": {
      "type": "array",
      "description": "The boundary of what this slice delivers — distinct from user_outcome (the one-sentence result) and from acceptance_criteria (the testable checks). Bullet-level statements of what's included. Empty array is valid only when the slice is trivial enough that user_outcome + acceptance_criteria already state the full boundary; the field must still be present (records-as-JSON: this was previously a `## In scope` spec.md heading, scraped rather than validated).",
      "items": { "type": "string", "minLength": 1 }
    },
    "out_of_scope": {
      "type": "array",
      "description": "Explicit exclusions — things adjacent to this slice that it deliberately does not do. Each item is a Rule 2 boundary statement, not a deferral (a deferral needs why/tracking/acknowledgement in status.json's open_deferrals; out_of_scope just draws the line so the implementer doesn't silently absorb adjacent work). Empty array is valid (nothing adjacent worth calling out), but the field must be present (records-as-JSON: this was previously a `## Out of scope` spec.md heading, scraped rather than validated).",
      "items": { "type": "string", "minLength": 1 }
    },
    "covers_needs": {
      "type": "array",
      "description": "Intake need ids this slice delivers (vertical trace up). Rule 8 requires every slice to thread to at least one need.",
      "minItems": 1,
      "items": { "$ref": "#/$defs/need_id" }
    },
    "effort_complexity": {
      "type": "object",
      "additionalProperties": false,
      "description": "Two-axis per-slice rating set by the planner during decomposition (ADR-0011 §3.7), each axis anchored to a named standard so low/high is decidable rather than a vibe. COMPLEXITY (Cynefin) drives model choice + verification rigor: low = Clear/Complicated (a knowable right-or-good answer exists; expertise, not discovery); high = Complex/Chaotic (the solution shape is emergent, or the blast radius is wide). EFFORT (relative agile sizing) drives timeout/retry budget: low = fits one implementer sitting on a bounded surface; high = multi-sitting or broad surface. The quadrant is DERIVED from the two axes and is only a human-readable consistency checksum — nothing branches on it; the two axes carry all behaviour.",
      "required": ["effort", "complexity", "quadrant"],
      "properties": {
        "effort": { "$ref": "#/$defs/effort_axis" },
        "complexity": { "$ref": "#/$defs/effort_axis" },
        "quadrant": {
          "type": "string",
          "description": "Derived checksum label: low/low=quick, high effort + low complexity=grind (known but voluminous), low effort + high complexity=puzzle (small but tricky), high/high=beast (big and hard).",
          "enum": ["quick", "grind", "puzzle", "beast"]
        },
        "rationale": { "type": "string" },
        "confirmed_by_implementer": { "type": "boolean" }
      }
    },
    "risks": {
      "type": "array",
      "description": "Risks the planner enumerated, each with its mitigation. A stated mitigation is binding direction for the implementer (the captain's design-review treats it as load-bearing, not advisory), not a suggestion.",
      "items": {
        "type": "object",
        "additionalProperties": false,
        "required": ["description"],
        "properties": {
          "id": {
            "type": "string",
            "description": "Optional stable id, e.g. R-01."
          },
          "description": { "type": "string", "minLength": 1 },
          "mitigation": {
            "type": "string",
            "description": "The concrete mitigation. Binding direction when present."
          }
        }
      }
    },
    "acceptance_criteria": {
      "type": "array",
      "minItems": 1,
      "items": {
        "type": "object",
        "additionalProperties": false,
        "required": ["id", "text"],
        "properties": {
          "id": { "$ref": "#/$defs/id_token" },
          "text": {
            "type": "string",
            "minLength": 1,
            "description": "The acceptance criterion in EARS notation."
          },
          "ears_pattern": { "$ref": "#/$defs/ears_pattern" },
          "test_refs": {
            "type": "array",
            "description": "Forward trace: test names/paths that verify this AC. Filled as tests land.",
            "items": { "type": "string" }
          }
        }
      }
    }
  }
}
