{
  "$schema": "https://baton.sawy3r.net/schemas/spec-v1.json",
  "slice_id": "S01-example-slice",
  "release": "YYYY-MM-DD-theme",
  "track": "T1-example-track",
  "user_outcome": "One sentence: the single user-reachable outcome this slice delivers.",
  "rationale": "Optional human-authored prose explaining the slice. Never machine-parsed.",
  "touchpoints": ["path/to/file.ext"],
  "references": [],
  "in_scope": ["Bullet-level statement of what this slice includes."],
  "out_of_scope": ["Adjacent work this slice deliberately does not do."],
  "covers_needs": ["N-01"],
  "effort_complexity": {
    "effort": "low",
    "complexity": "low",
    "quadrant": "quick",
    "rationale": "Why this effort/complexity rating.",
    "confirmed_by_implementer": false
  },
  "risks": [
    { "id": "R-01", "description": "What could go wrong.", "mitigation": "The binding mitigation the implementer must follow." }
  ],
  "acceptance_criteria": [
    {
      "id": "AC-01",
      "text": "WHEN <user gesture at the entry point> THE SYSTEM SHALL <observable result>",
      "ears_pattern": "event-driven",
      "test_refs": ["TestThatVerifiesThisAC"]
    }
  ]
}
